id,source,app_type,review,rating,date
7e6f764126aeade087e2adfc39b54bc2,google_play,customer,never been disappointed,5,2025-09-28 03:56:59
eec92242556d3d8eb8ab37f5d2655cf6,google_play,customer,yayyyy foooood,5,2025-09-28 00:43:57
a085d922dd78b980f600cedd80ae58d8,google_play,customer,"App usually works well enough, however my latest gripe is due to a recent update that insists on sticking the 'upgrade to GH+' button *directly over the 'place order' button* so I can't place an order 'til the previous button times out and disappears (I can't swipe it away or otherwise remove it). It goes without saying I already *have* GH+. Still wish there was a dedicated, static section for the restaurants we've saved, but hey.",3,2025-09-27 22:53:03
b012091d00ff7d30955d9016b6a2a5d0,google_play,customer,"Fraudulent Business that enables criminal drivers/workers! No products were received, and no help from GrubHub corporate employee. Credit Card fraud in that it enables drivers to imply they are providing a service, yet the high number of reports of items not being received and drivers playing ""But I left it at your door, oh must be your neighbors"", and try to provide a picture of buildings and residences rather than actual delivery items at your doorstep as proof of dleivery.",1,2025-09-27 22:36:16
319294848158699b8fb1fa7ccc3874fa,google_play,customer,"WHY DO I NEED TO PROVIDE A DELIVERY CODE?!?! this ""random delivery number"" it's ridiculous. I do no contact delivery for a reason. but now I'm forced to send a number to the delivery person which they can't drop off till they get, but yet I can't send the number till I confirm the number till the order is dropped??? make it make sense! YOUR PROBLEM IS THE DELIVERY DRIVERS YOU HIRE NOT THE CONSUMER. Delivery code does not work! yet again it's making things worse for drivers and customers! CRAZY",1,2025-09-27 22:00:04
59fa5805f6596adf681b2c00ea43ba34,google_play,customer,they wouldn't let me cancel my order for any reason.,1,2025-09-27 21:48:28
aff3a823f9e011a24c9c3bea7192c1d3,google_play,customer,Demanding that I give you a rating means you're getting a 1 star rating.,1,2025-09-27 21:10:38
3de14e8d487f24ff72f22355113008ae,google_play,customer,"Awful app. Pain to use, with awful navigation and sorting/searching options. Bad fees of course, and also really frustrating identifying some pastas as 21+, also preventing gift card use. Really awful overall",1,2025-09-27 21:03:10
6a9bbaad8e008815fa4b707a3b875ce8,google_play,customer,i should not have to disconnect my vpn just to be able to order dinner.,1,2025-09-27 20:57:10
aeae42c55e93a02fd7cffab39f2099a2,google_play,customer,cancelled order with no explanation,2,2025-09-27 20:15:05
b91579ae922aa6a776c5b9cc648d7bd9,google_play,customer,Always do a good job and are personable!,4,2025-09-27 18:57:53
ab47d4b7e7aee54b789ae5e389df7cdd,google_play,customer,pooh,1,2025-09-27 18:28:35
07abbce7693df9818f9fa8c05f95c701,google_play,customer,"they don't make clear when fees are from grubhub or another service the restaurant is using. considering the prices are inflated compared to when you go to the store, it's hard to believe you're only paying a service fee to get food delivered and it's made worse when you know the delivery fee isn't even going to the driver",2,2025-09-27 18:07:46
6997de081471f6d269778f00d1a3eff0,google_play,customer,The last two weekends in a roll we did not receive our full orders and I had to reorder the items that were missing. I never received a refund from last weekend I probably want get a refund again. I will not order from Grub Hub again if I don't get my refunds .,2,2025-09-27 18:05:13
3d29644e1e17f48ef0d73ae15aa0536a,google_play,customer,Grubbin!,5,2025-09-27 16:57:18
b5fe725ec463934172e179c8ef005c67,google_play,customer,Good service.,5,2025-09-27 16:55:48
dd810fe3b312bbae351763ba17003072,google_play,customer,Love that on days I hurt too much to go out I can still have a nice lunch I didn't have to make. Thank You GH.. 游땕 it a great service and I appreciate it.,5,2025-09-27 15:20:58
87945eb33611510a27c1b6cd8ca67021,google_play,customer,New AI chatbot is worthless and doesn't actually do anything to help.,1,2025-09-27 14:30:56
37f65d9f3f0d33c6373aa358abda97b0,google_play,customer,"Originally celebrated is now a negative. Driver forgot my desert drink and Grubhub would not refund because of too many refund requests? Next one, the restaurant made my food wrong and I thought partial refund. No partial refund for the same reason. These are not my fault. They need to add a section of restaurants that have a rating of getting the order correct for the consumer. And an alert check list for the drivers to double check that they didn't leave the customers drink in their cup holder",1,2025-09-27 14:29:21
56db57609263d38b0645386eae9c453f,google_play,customer,I've been waiting on my order for 2 hours!! The driver won't answer the phone or text. So I had to reorder my food. I just wasted 23.00$,2,2025-09-27 14:19:21
07b3fc9e8f1b0ba1d3d983078318d4a8,google_play,customer,love it!,3,2025-09-27 13:30:07
839ca4f9b79176939dabdf886d505178,google_play,customer,GrubHub needs a warning for restaurants that refuse special requests that they're risking noncompliance with the ADA.,3,2025-09-27 12:06:47
ec9f17317d062206b8cdac4dfdedde03,google_play,customer,"The fees they charge are ridiculous, the more items you order, the higher the fees, I would love to understand their justification behind the fees. in addition, tips are mandatory. I will not be using GrubHub moving forward. They exploit customers.",1,2025-09-27 10:36:02
46047057050a55eb4fa5a01fe20f7778,google_play,customer,they sent my food to the wrong town and wrong address,1,2025-09-27 08:13:15
769ab53f5159a3dd6db80b09f9fa58c8,google_play,customer,"Fast and friendly service, with timely texts and notifications from both driver and service. Reasonable fees and charges.",5,2025-09-26 23:17:06
7dda67dafd12d43429b2d915293c86a2,google_play,customer,way too many mistakes and horrible customerservice for issues,3,2025-09-26 21:17:52
035f855061a41aedb44692540df513d6,google_play,customer,Great experience.,5,2025-09-26 21:15:00
1c61a44997fb8c4104c4069a2b0c428c,google_play,customer,they have fake inflated prices again in a 3 week period. and its not the shops its grub hub being greedy.,1,2025-09-26 20:08:20
094dc01509ed542d6df26225ffc35770,google_play,customer,For some reason they will not use the locations closest to me.,3,2025-09-26 19:38:55
11975a30e69513770c2a9cdeef43fbee,google_play,customer,"perfect for when I don't feel like leaving the house. I would use it more if the prices aren't so exaggerated. fees and tips, I get it but the items are also increased. hence the 4",4,2025-09-26 19:27:39
e5b228d29aa7f48671655d6b589bd14f,google_play,customer,horrible design for user friendliness,1,2025-09-26 18:54:47
24094702c1bc843fb963d18e57b9e420,google_play,customer,so easy to order. delivery times are always nearly doubled from other sites. that's always disappointing. drivers are always nice.,5,2025-09-26 17:21:36
9387391cabaa4575eafb9ad1ab42f59e,google_play,customer,Shady buisness. Drove for these guys for 3 years then banned and they don't tell you why. Use doordash or Uber if they're in your area.,1,2025-09-26 15:38:35
f0db651e5ca11ec111b5f7166eb3b6b0,google_play,customer,love it..very convenient when pressed for time!,5,2025-09-26 15:35:44
5795a3d39c5003bc2ba2db9a8e9a3b23,google_play,customer,"I've used the app only about a dozen times so perhaps my experience might be atypical, but every time I've ordered and received food has been just fine. The couple of instances where a driver had stop(s) ahead of mine still managed to get me my chow hot or nearly so. Maybe it's my locale, but I wouldn't change a thing.",5,2025-09-26 13:11:20
1fc6653b4c9522a4f700e3304a7d4a11,google_play,customer,better than Doordarshan to me well for now.,5,2025-09-26 12:52:04
7b82c719efff4188a7a4ccf341467f2c,google_play,customer,"even though we have prime, which reduces costs, it takes almost 90 mins for anything to arrive or order gets cancelled 60 mins into waiting for it to be picked up.",2,2025-09-26 12:18:27
08efa76ccef33e8e3b0c0f15b694db56,google_play,customer,awesome I love it!,5,2025-09-26 12:12:57
cf0245112ee7cb6530d95006cee34be1,google_play,customer,great place for breakfast and lunch. can't go wrong.,5,2025-09-26 11:49:10
2d7560beb76d6700f7a0a14ddbe2323d,google_play,customer,they happily drive in Atlanta游땘,5,2025-09-26 05:05:30
0c451b9690ab3d7630a9099189bc1835,google_play,customer,doordash has at minimum a $14 operations fee now.,5,2025-09-26 02:09:59
836d04ab683dce3830a08d10606c1098,google_play,customer,hard to see anything with the ads covering the screen. Even if you have plus you still get all the ads... still,2,2025-09-25 23:44:10
eb4470d283006c7a7868097bf8faff47,google_play,customer,love the service,5,2025-09-25 22:09:35
b3318801c8abf4f7eef0f6592649fbc5,google_play,customer,"I prefer Grubhub over other delivery apps, very easy to use",5,2025-09-25 20:03:17
dd3f68edf7a917cdd1eeb3762ea784dd,google_play,customer,"This app does not work AT ALL. When I attempt to put in a delivery address, it lets me enter the information but then has no way to proceed. When I click a suggested address, nothing happens. It took me many tries to finally get this to work and move on. I have attempted to place 2 different orders from different restaurants on different days. I cannot proceed past ""review order"" because the app says something went wrong.",1,2025-09-25 18:44:53
f50f9a37d3f1ffd1ecc6120edf0ec343,google_play,customer,"I had an issue with an Order, and the customer service was great!",5,2025-09-25 18:28:11
38db2ddb858db17457d562b6ef374822,google_play,customer,Decent prices and an easy to use interface,3,2025-09-25 18:17:26
7ccb0564779ae6f7ad0c424caf241c4e,google_play,customer,love grub hub,5,2025-09-25 17:51:02
0b002c3c891368441875f7abfb6db861,google_play,customer,Would have given 5 stars but I can't seem to order from Waffle House,4,2025-09-25 13:15:29
78c2842c66ba6e5943e10c86f9a5fca3,google_play,customer,only because they messed up my order,2,2025-09-25 13:10:26
86a1cd3c79aff517ab1efa45e771823b,google_play,customer,you should add the option to refund someones tip on the app my orders are just wrong every time I give a chance if you allowed your customers to submit the option to refund tips I feel like it would incentivize your workers to actually take better care with someone else's money,1,2025-09-25 12:28:20
b88a864f39a64e669f4bae6c14cfb540,google_play,customer,"grubhub for campus is AWFUL. my entire account is glitching (have reinstalled the app, etc) and i haven't been able to order for about two weeks. it keeps telling me that the campus restaurants do not accept meals when they most certainly do. as a student, it's making my life really difficult because i can't get my quick meals that i pay for with my dining plan. support has not been helpful and just keeps redirecting me. i wish my school had stuck to our old system.",1,2025-09-25 12:15:27
892bd8576448adabf153c2acc78625a4,google_play,customer,"it's an absolute nightmare trying to cancel orders. no other delivery service is this awful. just go with doordash or grubhub, anything but this",1,2025-09-25 09:16:04
84a03a163f3ff661cbe4aee7c8389ae8,google_play,customer,The GPS is always wrong about the location. Sometimes I forget to switch my location manually and my food will go to the incorrect address. T You need to be prompted prior to purchases to ensure the address is correct to avoid this problem.,3,2025-09-25 08:29:38
bfa339006467d348fcd3d2f1de580720,google_play,customer,grub hub has more tax and tip compared to Uber eats. hmmm 游뱂,3,2025-09-25 00:34:14
67bb41c843724041eac0d04ccc003d10,google_play,customer,"great service, my truck is broken down now.",5,2025-09-24 23:26:31
dcc569d95f86c476b96a42bcfb210442,google_play,customer,"Garbage ghetto customer service, no resolution. They couldn't care less",1,2025-09-24 20:28:29
bf3c874ba76ef30abe25b1f5ceb88cbe,google_play,customer,Support absolutely sucks. Restaurants frequently mess things up. I've had drivers deliver to the wrong house over half of the time. Just go to the restaurant. It's better than wasting your time and money on service fees and inflated prices.,1,2025-09-24 20:25:29
aaba0f0bc0391156c382d3fe8a248620,google_play,customer,App is utter garbage sent my chipotle pick up order 40 minutes away when we have one on campus which is a 15 minute walk.,1,2025-09-24 18:15:29
88e51badc80afd03515529701285e4fb,google_play,customer,love this app and the free shipping with Amazon prime!,5,2025-09-24 13:54:46
69c7c9c189063233113d9c04014af629,google_play,customer,Service is always quick and professional,5,2025-09-24 13:52:22
91c38e8012b08035243fd847400bd8f3,google_play,customer,"you can actually put your references in, not like others",5,2025-09-24 12:05:54
50ca4a368c56d5879c05718012f0d983,google_play,customer,The order tracker is always way off from the driver's location. The driver's rarely follow the instructions. Orders are delayed more often than not. Do the Dash,3,2025-09-24 08:14:01
5a350be255338f43abd46ebe1d224584,google_play,customer,"A complete disaster!!!! It's a shame I can't post a picture. They only have ONE restaurant available to get food from, and then 7-11.....What a joke. This is why Door Dash is on top, lol. I downloaded it to see if they had restaurants that Door Dash didnt have.",1,2025-09-23 21:38:02
7c45200939faace00cc004942ebc764b,google_play,customer,really bad I don't get any opportunities,1,2025-09-23 21:24:08
52c691dff1bbb1cfffe1ccd46a7722a8,google_play,customer,"Grubhub is an utter rip-off. Exorbitant fees are charged, wait times are ridiculous and the deliveries are often late and cold. sometime orders are simply cancelled. These are common occurrences using this app. Maybe they were decent a few years ago, during Covid, but now a textbook example of 'enshittification'",1,2025-09-23 20:32:30
cbfb71dba96a10e5cb68d3347e0adb5e,google_play,customer,"Horrible, raised prices on fees and minimum orders. then they broke promotions, do not bother they do not work, they will not apply. Even the button to add the promo to your cart is greyed out and nonfunctioning. Look somewhere else.",1,2025-09-23 19:59:40
e1aa8f9ad96bec7d08b96eb9be2df302,google_play,customer,"If you have never tried Pho, this is where you need to start. Best around.",5,2025-09-23 18:53:32
7dd6469e124def081bd4d2ff239775cb,google_play,customer,"The options are great, but whatever GPS they use for deliveries is grossly inaccurate. Completely stopped using GH because of this and when you try to tell a driver its not correct they just want to argue with you. Don't have the same issues with any other delivery service (Uber, Uber Eats, Amazon, UPS, etc.), so it's definitely a GrubHub issue, but certainly has never been addressed since they are currently doing the exact same thing for an order my wife placed 驕멆잺",2,2025-09-23 18:08:12
cb856a106fae9a7c848099be5240ac0c,google_play,customer,customer service was a joke I had to wait 3 hrs for a meal couldn't cancel my order never doing this again.,1,2025-09-23 16:06:41
e0489e71fb82a17d7248c44acab8bbf1,google_play,customer,Great service,5,2025-09-23 14:43:33
f96f88bc1bd9549d3847ae810c567460,google_play,customer,"orders never arrive or are missing something. I talked to my neighbor where the driver took a picture of the food from the street, holding it in his hand. She said he saw The driver out there but he didn't actually bring the food to the doorstep, nor did he leave it. Don't bother ordering from the site I think they don't do good checks on their drivers or something but save yourself the time.",1,2025-09-23 13:46:55
152bf1105e2e12a5e90cc3fedcbe591d,google_play,customer,"You need a better system to report problem drivers. My delivery person couldn't find a major chain hotel, took a dark and blurry photo for proof of delivery, and said they left my food at the address I gave. ... it's a hotel. Where? I told then specifically where I was, outside at the entrance of the hotel and parking garage. Food was nowhere to be found. The app showed they drove right by me. They didn't even call and stopped replying to my texts.",3,2025-09-23 11:35:51
7d53c7a117a49d4a7b8b515d85598d92,google_play,customer,0 accountability if they get your order wrong. Customer service is deplorable,1,2025-09-23 03:16:49
6b757d492d0450f7c1d4550979b48680,google_play,customer,"They do not stand by the food they deliver, they could careless how late your food is or how much that messes up your day. The times they promise does not meet the time of service. Horrible service. I was told too bad for food over an hour late. It was cold and a bunch of slop. Use Uber Eat, or.any other service good bye you lost lots of customers just now",1,2025-09-23 02:33:08
05d764b7c3832895e3f5e941316883c4,google_play,customer,my order got delayed for 2 hours just to get canceled. terrible service.,1,2025-09-22 21:55:42
988242f6e80490438c3630c7a0872ed2,google_play,customer,Non-existent customer service. Grubhub will not allow you to cancel and force you to pay even if your order is taking 2 hours from when placed it. You have to pay for food that has sat for 2 hours. All of these food delivery apps are useless.,1,2025-09-22 21:08:19
db85820113ff6ff40d0316e5629cceec,google_play,customer,Excellent service !,5,2025-09-22 19:34:26
af32008673c8ce034dc3c334ca14eba3,google_play,customer,sucks,1,2025-09-22 18:06:17
7c9930c5882354715f9795477980987f,google_play,customer,"With the campus dining feature active, orders default to ""pick up"" no matter what you do. The interface still prompts you to tip your driver when you order for pickup. I have accidentally ordered for pickup from places I couldn't possibly reach on two occasions. I have now removed myself from my university's campus dining, because being able to use GrubHub to preorder food on campus isn't worth being likely to not even get my food specifically on occasions when I'm hungry enough to miss details.",1,2025-09-22 17:06:04
3597e041b2d40f48cb37993f8f5cbcd8,google_play,customer,I use Grubhub for a well-deserved treat 游땖,5,2025-09-22 13:45:59
6629890791f465de69e64df92332ad3a,google_play,customer,"The app is slow, always deletes my order when I exit out for a minute, and half of the things don't work even if both the wifi and phone data is on. The driver was trying to deliver to multiple people at once, causing them to be slow and late, and tried to give me the wrong food. The promo codes in the emails don't work",1,2025-09-22 13:28:47
ec25b6f11c92fb2d642fdea02b167263,google_play,customer,"I'm stuck at the hospital with my wife looking for food delivery so I don't have to leave her side, but every restaurant I've found has ""Delivery paused due to high demand"". I understand this happens through no fault of grubhub, but I don't understand why restaurants that are not currently delivering still show up on the delivery search. It's possible that one restaurant may not have deliveries paused, but I'm not wasting my time clicking through all the options in hopes of finding one",2,2025-09-22 08:44:08
de0c56748df22df275402b3eaa3565bf,google_play,customer,"gets easier to use, the more you use it.",5,2025-09-21 22:38:58
e8ad998237632362a48c8e6d6424c840,google_play,customer,"convenient , fast and affordable",5,2025-09-21 20:39:32
a7316b83bbf75ea69354e2d4eb8e7809,google_play,customer,5 times in a row either my order gets canceled without my doing of my food arrives cold dont use grub hub,1,2025-09-21 18:45:37
a37737ad197eeb514f76c842ab1af904,google_play,customer,complicated,4,2025-09-21 17:25:38
250d23a887e3e45598fa16ed07985ab2,google_play,customer,simplest thing to use,5,2025-09-21 16:28:35
66acd2fe8fcd638e29419f78a3a7c704,google_play,customer,"Fist time using grub hub, ordered KFC, ad said a free 2 pc meal with purchase of 15 or more. I spent 24. I called to see why the 2pc wasnt taken off my bill and they didnt know why. I asked to cancel, this is 3 minutes after submitting, and they refused, asked for a refund, they refused. Asked to speak to a manager that said I need to buy 2 of a certain item to get the deal. The ad did not say that at all. She agreed its misleading but still refused to cancel or refund. This is robbery. Illegal",1,2025-09-21 14:17:01
f7d67ecaa090a45431b504d405513500,google_play,customer,"I paid $20 to get food delivered in a timely manner. Total was over $50, and I NEVER got it. I cancelled the order after an HOUR watching the driver drop off other orders instead of picking up mine, which had been sitting there close to an hour at that point... Worst delivery app I've experienced (this was my first time trying GrubHub!). Just stick to the much more well known apps.",1,2025-09-21 11:16:36
b8fec76dce10b3725bd2495fe67dfcad,google_play,customer,ordered food they picked up wrong food ...I ordered from second restaurant they picked up wrong food...canceled both orders.. I call customer service they offer me $5....I am telling everyone abd anyone that will listen to use uber eats,1,2025-09-21 09:49:11
f078ea6a929caa0c2ca1fe57e188a2c2,google_play,customer,"get my address right. Also, ""brgr kng"" is not ""only ting opened now."" but capitally good try. take 40% now, good job.",1,2025-09-21 06:48:39
d3ff11395865bcd6477932a701d36f94,google_play,customer,"Grubhub is constantly overwhelmed to the point that it's not reliable. Orders are paused, delayed, and canceled regularly. I ordered something simple an hour ago and it just keeps getting delayed. Either they don't have drivers or their system is broken beyond repair. Update: opened the app out of curiosity tonight to see that literally every restaurant in the city is ""closed"" to delivery, despite being open and accepting orders for pickup (and delivery on other apps). grubhub is dead.",1,2025-09-21 01:23:26
b0f4f8b54eb2786d3ef2fa8ec07899cb,google_play,customer,very nice thank you very much,5,2025-09-20 23:19:22
95bd16f5df2d3336b66d9bc7e87dbb2f,google_play,customer,Horrible customer service to deal with,1,2025-09-20 22:16:35
c6f81f3be5c421d22f06114694494550,google_play,customer,"none of the drop-down menus work anymore, can I order from Burger King at all",1,2025-09-20 20:34:51
4c00bd84473fa81f4e286c523421852f,google_play,customer,customer service is awful cannot use credits given with another form of payment. Customer service is all AI no real person,1,2025-09-20 18:32:30
2f84b155685cf252da9f86ef8cf85f4d,google_play,customer,jus start using it and I like it,5,2025-09-20 18:03:20
4c2eeb5ec171fab5ac55655fea9b7f8a,google_play,customer,Easy app for healthy delivery options.,5,2025-09-20 17:17:42
fa3cbef0354dd6a90adae5ba0f7b64ec,google_play,customer,awesome,5,2025-09-20 14:41:53
c1572caa7bd9b4901a9e2e03f42c7f9d,google_play,customer,"Installed the app and tried to order food for the first time. Got told something went wrong. Made my order and tried up update my delivery instructions. Something went wrong. Tried to talk to customer support, none of them could see my messages. Absolutely terrible app",1,2025-09-20 11:26:44
892313b1b9b07b454226ff90ec62a6f4,google_play,customer,driver picked the food up 15 min early ...still managed to deliver late...cold.,1,2025-09-20 01:14:35
9d60309652e8dcc2610a66ddab6fda43,google_play,customer,"Great Service, Fast",5,2025-09-20 00:03:41
fc3419ddf29070ef3ba2dd6152678d58,google_play,customer,I'm deleting this app and going back to DoorDash. Not being able to customize where the pin on the map is when you live in a sprawling apartment complex makes this app basically unusable since no drivers ever read the extra directions.,1,2025-09-19 23:23:30
431b3a910d8d167cb045e6e6c6d1dcaf,google_play,customer,food was completely cold by the time we got it,1,2025-09-19 22:44:00
bf45fa56bebab67c18deacb70e312f2f,google_play,customer,amazing time and very polite,5,2025-09-19 21:59:45
8cdd3df6ddeb08f7948ffc9bde6c1f42,google_play,customer,"Opened food, tossed on the ground, and the driver calls and yells at you to ""grab your pizza now"" with a voice changer, so weird. And grubhub refused even a partial refund for a sketchy delivery with ruined food. Lost my business forever. They wouldn't even agree to never send that driver again, which was the final straw, just dangerous and weird they would be OK with that behavior from a driver.",1,2025-09-19 21:25:36
0f3a147ac1a21f16a131def1dd3e7f0a,google_play,customer,These drivers need to pay attention. I don't want any feedback. I don't need this resolved. Pay attention. You cost me time.,2,2025-09-19 21:23:45
75ca6ede7dd5f62492cbb971d273106b,google_play,customer,customer service sucks. placed an order and had to change the address they couldn't. asked them cancel the order for a refund no refund they gave me a credit. never had such an issue with uber,1,2025-09-19 20:52:17
a0686ff683ee0ab000309ffbc42e3ec9,google_play,customer,so far I love grub hub had a lot of issues with a competer,5,2025-09-19 19:49:06
c371765ebe571424ef81f60985882112,google_play,customer,Crashes alot during meal times,2,2025-09-19 19:00:00
e93f2d60f64008dd39d36750028dafb1,google_play,customer,love the app and their service great effort and process,5,2025-09-19 17:44:20
5ca3947b6f7c92ebf4b1ca553117ed10,google_play,customer,seems easy to do. better than the other's 游땔 definitely,5,2025-09-19 17:20:52
b95ca21208209d244451161261d8e162,google_play,customer,"The prices are higher in the app than if placed with the store. So you pay extra plus fees plus delivery. So, I only use it when I'm in a bind.",2,2025-09-19 17:09:18
4052f07f8806926d84d82566cdc0505e,google_play,customer,"pretty good, I believe that the issue with no available drivers has been corrected",4,2025-09-19 16:39:59
c24b5fb3e4ec33eafa51ab105225effc,google_play,customer,better than the other apps - better drivers,4,2025-09-19 16:10:17
