id,source,app_type,review,rating,date
74d61ec7b369eaf76f849c2fa9c12847,google_play,customer,"It's great having GH attached to my Prime account. Saves me $ on delivery fees. So far, all delivery drivers have been on time or early, and have been friendly.",5,2025-06-28 19:54:10
cc9f06fb424c3608124cabb91a983a6f,google_play,customer,"I am so tired of simple mistakes with this company in general. Most recently the issue was we ordered food for myself, my wife, and our 2 year old son. The food was picked up and delivered only for us to discover it was someone else's order. Apparently the driver didnt even bother to show the order to the restaurant or double check the name. A simple solution would have been a quick phone call for the driver to go back to the restaurant, but nobody could be bothered with that.",1,2025-06-28 19:47:52
f16792191d3899034a6a889fc5373d90,google_play,customer,it annoys me to need to tip driver before I know how well they did. I might give more even if it was after delivery.,4,2025-06-28 17:45:01
41b77eda87bfd173d488e8b66682177a,google_play,customer,Great job thank you,5,2025-06-28 16:34:57
0e68a0e0a15e91ec99f13f424bdbf022,google_play,customer,I gave y'all a couple more stars because y'all replaced my order and I really appreciate it. thank you for going above and beyond to fix my issue. please keep up the great work and I'll give all five 游때,4,2025-06-28 16:20:08
670d6da37d6b75313f64ffc5fa52cf1e,google_play,customer,horrible customer service,1,2025-06-28 02:07:57
3c376e3ec1cb2d72e971b78b20884dac,google_play,customer,"For God's sake, maybe ask the user if they're sure when they're about to place an order for an address over 100 miles away?? And they don't really let you cancel either since the merchant ""starts preparing"" your order almost immediately. Until the developer implements literally any kind of protection for this, it's a one star from me. I've lost way too much money on food that sits on my porch until I get home a week later.",1,2025-06-27 23:10:48
e744cf33b698c9c25c0035b60c07594c,google_play,customer,terrible experience with customer service. added a drink to an order immediately after placing it. The GrubHub app duplicated my order. it would not allow me to cancel the second order. then when it delivered they did not even knock so I could turn them away. contact your customer service they would not even help me out with a partial refund. then I asked to escalate to a supervisor and they ended the chat. basically once they get their money they don't care anymore. we'll never use GrubHub agai,1,2025-06-27 21:58:16
1541638835719c593b5e436a098c8533,google_play,customer,easy app good service,4,2025-06-27 21:43:39
6d4a80da1bab1db76aa585ebeaa75c2e,google_play,customer,"Anytime you get a ""delay"" in your order, that means they cancelled it already and they're going to waste hours of your time because you didn't spend enough money. I can't get this garbage company to successfully deliver an order less than $50. Edit: Postmates delivered the same order less than 90 minutes after GH cancelled. F GreedHub.",1,2025-06-27 21:26:04
a92daf5097c1a099bb431d244006944c,google_play,customer,"GrubHub has been a reliable go-to for satisfying my cravings with quick and convenient delivery. I appreciate the variety of restaurants available. Overall, it뗩 made food delivery smooth and efficient, especially on busy days.",5,2025-06-27 20:38:51
650beb2117e4d2d7eaf03a51b7e1ca12,google_play,customer,"Uninstalling Grubhub. I'm done. Three times I've left instructions for the driver because I'm disabled and the food is left nearly a block away. After that, I waited a long time for customer service to get around to removed my tip.",1,2025-06-27 19:48:56
a881211d80ee8643ddd7b6adde9a4233,google_play,customer,Terrible app and everything is more expensive!,1,2025-06-27 19:37:14
f9c97de6aba404a4a2ee9dc480c9a054,google_play,customer,love twisted pies pizzeria,5,2025-06-27 19:32:48
51f627e30e0a4e4be1004c8d2449c596,google_play,customer,poor delivery personnel.but customer service was good 游녨 thank George,1,2025-06-27 19:10:25
cdcd4c4efeec1ff4ba99cf84dd37d709,google_play,customer,my app will not allow me to contact anyone about deleting what I started as an order months ago . it keeps telling me there is an error and will not delete the order.,2,2025-06-27 19:03:12
627caf843135c3c379092ef2aa805464,google_play,customer,"Do not install this app. You are wasting your time and signing yourself up for having old food delivered to you. Grubhub doesn't want to refund your money when the restaurant sends you old. Do not install this app, it's a huge waste of time.",2,2025-06-27 18:57:38
a2f0bf1fa276e4ab0b0b2499711377ac,google_play,customer,when a turd needs to be made in a hurry...Grubhub,5,2025-06-27 18:22:09
021d6eb8d16e0ffe762705f428433435,google_play,customer,GrubHub and similar services are the reason that all restaurants have raised their standard prices. The app is fine though.,1,2025-06-27 18:06:51
570e88382066418f0cef9407411be2d2,google_play,customer,grub hub has always taken good care of my orders.,5,2025-06-27 16:38:58
bdbcb57fa062413be10ee42e159f8d1e,google_play,customer,"They steal from you. I never got what I oreder. They lie, they are disgusting",1,2025-06-27 16:16:44
826954c4212ddb9b6cec91762d4175f5,google_play,customer,"nowhere near as good as doordash or uber eats. can't combine 2 pymt methods, so when the issue you credit on a botched order, you cant apply those credits if your total is more than the credits, even if you have a credit card for the extra $2",2,2025-06-27 15:22:17
cc7a05b2303f97ba57bef753336ee28d,google_play,customer,"terrible customer service, clunky app that makes it too easy to duplicate an order. Half the time they will only issue an account credit even when they clearly owe you a refund",1,2025-06-27 12:43:09
3fd1c83fd3caea5956bc69d2c5d57e31,google_play,customer,i love it 游눮,5,2025-06-26 23:50:04
89d1a21444ee03844497cbe9d0400b39,google_play,customer,"I created an order but when I tried to check out, the app said the restaurant was closed. I called the restaurant and they said they were open & have had deliveries picked up throughout the day. I tried to delete that order to order from a different restaurant but it kept giving me an error. I ended up having to delete the app & reinstall it. App is useless if you can't order!!",1,2025-06-26 20:19:31
8d21380f11e89cd083612d21b5e2e72e,google_play,customer,way won't it work with my Amazon account!!!! everything else perfect. but I want my discount!!!!!!,3,2025-06-26 18:04:26
988f3d560dab9738ce372975ae9b5662,google_play,customer,"worst delivery experiences I have ever had from any app. two hours for little Caesars that is a mile from my house, missing items, refusal to refund or cancel. $7 credit on a $30 order",1,2025-06-26 17:20:36
3ff591d4b1f7a35e510dd1550b8effe0,google_play,customer,amazing services,5,2025-06-26 11:52:06
2c8ac97e97bc72d641bbfdf6b3aaf4bb,google_play,customer,well let's see one of their drivers hit my car and left the seen my car isn't safe to drive because they hit it so hard it messed up so much stuff it's not worth fixing it I'm a single mom just brought this car in April last year n have no money to fix the vehicle since drive drove off without leaving any information and customer service don't wanna help either I would give zero stars but I can't I'll never use GrubHub and I have told everyone I know to stop too they haven't used them since,1,2025-06-26 09:52:47
e8493915d16420ecbedc768ab99f80a4,google_play,customer,"I was given a 19.99 delivery fee, left Uber eats for the cheaper delivery fees. No way. where can I post the screenshot of this delivery fee. Deleting my account, which is made hard.",2,2025-06-26 04:41:14
d983c08f7f1cd3b2143ddcbef41308c7,google_play,customer,"Doordash is quicker, and my food arrives in 20 mins instead of 1.5 hours with grubhub. Twice it happened. Instead of grubhub giving me a refund, they have given me $5 for my next order, which I used, but the results are the same - 1.5 hours fast food delivery and cold food. I recommend switching to Doordash or Uber eats because they are consistent with their speed of delivery and the food stays warm/hot.",1,2025-06-26 04:01:24
e754ad976951c850a4ec12a92d445378,google_play,customer,"The customer service is awful. I waited over 30 minutes to try and talk with someone only for them to disconnect from me. I then waited for another 20 minutes to talk to someone else for them to rush me and ask if I was still with them if I didn't respond in 30 seconds. I wouldn't even bother using Grub Hub, use Instagram that goes through post mates. The customer service is better and it's cheaper.",1,2025-06-25 22:45:25
58739c0d01b28b192bc7667d46806e1e,google_play,customer,always easy to order and food is always hot and fresh!!,5,2025-06-25 22:36:38
37599c3168d25aaa0aefde4e816d62fb,google_play,customer,"we ordered food from here and when I tried to change the address it would not let us and when we told the driver, he did not care and continued to deliver it to the wrong place",1,2025-06-25 22:36:07
b537bdb91c3c0052a5ae0b87dd15d77d,google_play,customer,"very unhappy with this delivery service. My food is often cold and takes forever, even if the restaurant is close to my home. and food often missing from my order happens more from this service than other delivery apps.",2,2025-06-25 22:07:21
37853f3c0dd8ad09a763fb462d336e3c,google_play,customer,easy to use,5,2025-06-25 21:24:53
307e3d8588f020c729b88b23e57cb30d,google_play,customer,Gave me a promo code which later disappeared when I tried to use it. Very scammy app.,1,2025-06-25 21:19:48
c08b06fae74822272e6cadb0396599b3,google_play,customer,fast refunds if order is wrong or nasty. Great options and variety.,5,2025-06-25 21:03:55
dbbe885752dbb7228a1fb7e139fbb1d1,google_play,customer,love placing orders here,5,2025-06-25 21:00:10
7ad66cd6cd4abad5b77eea874142eb4f,google_play,customer,works about as well as all the other food delivery apps in my area. A nice thing is the discount for being a prime member. The downside is the absolute atrocious excuse for a search function they have. I just searched for pasta and my top results were about 8 different pizza spots and then an ice cream parlor that serves literally zero food. How the hell does an ice cream parlor come up when I search for pasta?,4,2025-06-25 14:48:12
d5dc62df51049625a491a1aaea55d88c,google_play,customer,they upcharge everything then also charge service fees,1,2025-06-25 09:03:30
3b40308bfb5e67c80f58e77d37a2583c,google_play,customer,Only use if you want your food cold and late.,1,2025-06-25 05:18:23
be5acfdf63798d0c2e756ac867fbcb2d,google_play,customer,Grub is the Hub need I say more!,5,2025-06-24 23:52:35
c4319144671ff0a50fcdf230e8d42ac1,google_play,customer,"Doesn't work for my area, and also can't use it when I'm at work because nothing is close enough.",1,2025-06-24 22:48:18
1963e5cd2031c01b26e923da263083dd,google_play,customer,Good service,4,2025-06-24 22:02:31
ecab1fbbb048f88826988611b2cd398c,google_play,customer,love the service and never had a problem with the app or service,5,2025-06-24 21:39:50
95442524973f67a885f29c5770323ca7,google_play,customer,"recieved the wrong order tonight, customer service chat will not connect after 30 minutes of waiting. customer service phone number hung up on me twice. Very poor customer service.",1,2025-06-24 21:19:20
d6f0380f335a8a8996a004a032234478,google_play,customer,Grub Hub plus coming with Amazon prime has been life changing,5,2025-06-24 20:12:47
c7fcb2ec59aa8a35a65b57d9fab2b110,google_play,customer,Unreliable. 2 hour waits. Chat support is down (pathetic).,1,2025-06-24 19:22:26
7b1257628daefa8565d3e742335f90d4,google_play,customer,Terrible app that wont update address as need it. sent my food to the wrong place on mulyiple occasions,1,2025-06-24 17:52:31
0c09200dde099d8fbdb720bc59dbf5ab,google_play,customer,the app is great except the limitations with the menus at most places also customizing orders is very limited. which is annoying and the drivers like to ONLY leave the food without contact. which I prefer my food handed directly to me to avoid any issues. and the drivers ignore that preference mark with the delivery instructions. but those are small kinks that I am sure will work themselves out in due time I still like to use the GrubHub option when ordering my food for delivery its simplistic,4,2025-06-24 17:02:28
3ac3c51c6b6295141b0f02fb841ed736,google_play,customer,"always convient, always there. lol",5,2025-06-24 14:53:45
ce8668dd63af2327640aa427b66590e3,google_play,customer,"They don't always get to the correct address and, though I get a refund, I feel there should be a coupon each time for the inconvenience. I wish that they would offer more incentives. I have been using this app regularly for 6 months and got one incentive discount. Customer service say the same thing and nothing changes",1,2025-06-24 14:42:48
255129a935e93b4be1b5876f1944ec97,google_play,customer,Placed an order at 11:45am and it didn't arrive until almost 2pm even though the store was only .2 miles away from me... support took forever to connect and was unhelpful to the situation. The driver was going the entirety wrong direction the whole time and they wouldn't cancel.,1,2025-06-24 13:03:42
74c3d9fc85cb1bc18ad00ba4622677e0,google_play,customer,"GrubHub cancels orders over 60% of the time. Sometimes people get assigned but never pick it up. An order can take hours to receive, if it does get assigned. Talking to customer service doesn't go very far, either.",2,2025-06-24 07:16:05
5b7e6c18cca2b2c5aae702e04d24493c,google_play,customer,"GrubHub have good service so far, I hope they continue...just a side note from my experience Instacart has not, or their delivery people, I won't be using them anymore!!",4,2025-06-23 22:47:20
190d9d1850eb72b9a79d48124cc8e269,google_play,customer,always on time,5,2025-06-23 21:21:34
3d1fd372ca169eff36aa11458bee6736,google_play,customer,"I'm not the kind of person to leave negative reviews AT ALL, but I'm not sure who's at fault here either because all my problems have been w/delivery drivers! This makes 2 days in a row that my drivers have had issues delivering my food. Yesterday, the guy took a deviation and was 20 minutes late. Today's driver didn't even bother to follow my delivery instructions TO DROP OFF my food INSIDE my work address because I'm working. If I had a car, I'd just go myself! Get better drivers WHO LISTEN",1,2025-06-23 20:35:42
60fa40808f796fb000333d37faa36f78,google_play,customer,supposed to be FREE delivery but I was charged!,3,2025-06-23 20:26:20
e7daaed143dd42c76419a5adab5dcf3b,google_play,customer,used my free year from Amazon prime and didn't realize how awful GrubHub is compared to Uber eats or doordash. very rarely. do they get an order right.,1,2025-06-23 19:27:36
2e0df0a9733bfc7e6f89305c9a2fe554,google_play,customer,Ap don't allow you to use all of your credit at once & support couldn't help. & the fees were almost as much as the cost of the order,1,2025-06-23 17:20:02
cfffcd959a38a69338ec0996e6ef8b2a,google_play,customer,"I received the wrong order, different restaurant same name as me. Customer service has been ignoring me for an hour not happy with the experience.",1,2025-06-23 15:18:43
ef1878ec229a0fcb0a3ebca3d87f178b,google_play,customer,"the app is not letting me place my order and after restarting my phone, it is still not working",1,2025-06-23 13:40:22
70b6f9a95123d6569298ba6b603d81f1,google_play,customer,refuses payment. I have the correct card and have more than enough. absolutely refuses to accept it.,1,2025-06-23 12:02:54
833012872efe54dc672a3f97c1b7ee46,google_play,customer,excellent app,5,2025-06-23 12:01:38
9f7971447540f22f1f4e5c6dcd73124c,google_play,customer,Great prices good food,5,2025-06-23 11:13:07
120170fbbcbdfc21ff187d60717ddf71,google_play,customer,Have restaurants open hours wrong,2,2025-06-23 00:09:16
12e3e5930a1f9971409b5250396f866c,google_play,customer,Not for double price,2,2025-06-22 23:06:41
f4178043930cbaa572288d18dbee4cfd,google_play,customer,Can't even connect to customer service now even after waiting for an hour and that means I can't get a refund since that needs chatting with an agent. Can't recommend this app anymore.,1,2025-06-22 22:09:42
985b3962d6af057f556a63cff7397520,google_play,customer,im so glad a friend recommended GRUBHUB to me. they will deliver to my place where others won't. the drivers have been very friendly as well.,5,2025-06-22 18:25:39
13dd9c5285533576c29d9724eff70c7a,google_play,customer,so far so good 游땕,5,2025-06-22 17:20:21
1d0a17f1961aa8e3faf1c5338dad8d9e,google_play,customer,"I LOVE Grubhub! Always on time, always good service, and if any errors arise, it is taken care of immediately 游",5,2025-06-22 16:48:39
f8d7f0032b1fb0741c4c5527ff623eee,google_play,customer,always rad,5,2025-06-22 14:18:42
35d3e5bad6fc458edd13b61d964e5f52,google_play,customer,"Trying to delete my account, but seems like they are ""having server issues"". Funny how literally every other part of the app and website work perfectly fine...",1,2025-06-22 12:48:01
621f3ea28cb3b064c33ab64f2d862e61,google_play,customer,"I can't even order food there's always some error or ""unexpected issue""",1,2025-06-22 09:53:59
b9226c5cfd03e64a127fca383b4e9f0b,google_play,customer,"I personally did NOT expect this particular deliver driver to come bring over the groceries after the last time she drop off of breakfast in an alley. I reported her to customer service. And they're letting her deliver food under someone else. The delivery driver turned out to be a guy instead of her. I warn you all to be alert when comes to the individual named ""trinity"". Anyone living in the DMV be on lookout. Idk why folks eat food that do not belong to them. Why are they still working?",2,2025-06-22 08:30:05
b548581ae4c65866aff0afbb116b2219,google_play,customer,"They never bother to check if there are any delivery drivers available in the area, so your order will sit in the restaurant until the cows come home while your ETA keeps getting later and later. There is NO ONE in the so-called ""Chat"" that is supposed to help you, either. Save your money and energy and order directly from the restaurant or through another app.",1,2025-06-21 23:55:22
bf6a59a7eb367444aaab154956cdb96c,google_play,customer,"In the past few months, it seems that the quality of customer service AND drivers has declined. In my past several orders, I have had missing items, and it seems to be due to mistakes made by drivers, in that they aren't checking the receipt to make sure they have collected all the items in my order. Additionally, though I have added clear instructions, drivers frequently misplace my orders or provide photos that don't show an obvious location, meaning I have to search my entire building.",1,2025-06-21 22:55:30
64ef24ec85a5b09748572b54826214f3,google_play,customer,great prices good service,4,2025-06-21 22:49:57
3f4bba8f32486f82e47b72eb3c648dc4,google_play,customer,it's over my budget but once in a while I treat myself to something I can hardly afford.,5,2025-06-21 21:48:11
a0909a9b27bf5dbb956ac8bbb0d02ad5,google_play,customer,"Absolute worst app ever. Tells me they either can't add my card or it doesn't work, same thing with GPay and PayPal. Finally was able to add a card so I go to submit the order and now it's giving me error messages saying it not able to submit it. so I figured I would just empty the cart and add everything back again. Won't even let me remove items from my cart! keeps telling me ""Error deleting item. make sure the information is correct and try again"". What info is there to even confirm?! Garbage",1,2025-06-21 21:44:32
22285e09a399b82180758dd59073cdc4,google_play,customer,make ordering easy,5,2025-06-21 21:28:38
7a78fdca7a07fb29de37740a84714b24,google_play,customer,"great service, great drivers.",5,2025-06-21 20:29:03
68d5fcb4aad042a1d581c0147944f284,google_play,customer,your address input doesn't work,1,2025-06-21 19:44:17
fd5a943f20a3183239ec1a29a56a8ebc,google_play,customer,My local goto. very rarely disappointed.,4,2025-06-21 19:42:30
d17ca724bc52f2afac46eca1357184d4,google_play,customer,"The service and customer support are just ridiculous. It's hit or miss if my food even shows up, and when it doesn't, customer support offers $5. Almost every time I order the delivery time gets pushed back an hour. I'm really not happy with this service.",1,2025-06-21 19:16:41
2a2d56a6251f9dc9da008d952264c8e6,google_play,customer,"Can and Will change your order on you and Not change the difference. Even if you Order 123.22$ in Groceries and the driver Accidentally drops off an $8.00 sub sandwich, which you attempt to file a complaint for. You will find the customer service lacking. There is no way to actually file a complaint. You can only state that things were late or you found a cheaper price. To which they ask for timeframe and proof of said cheaper price. You can get into a chat with an ""Associate""...AI.",1,2025-06-21 17:10:06
77f8b6c3b6128588607accd9207cf8a8,google_play,customer,Great.,5,2025-06-21 16:15:10
ea82092bf46dc24fb88ec194c2cfbf21,google_play,customer,The Amazon Prime/GrubHub+ deal does give free delivery and discounted service charge but the menu items are significantly more expensive than the restaurant and other delivery services such as DoorDash. It's not a good deal.,2,2025-06-21 15:51:01
d7cff85d8caf66721571006a65e8f5ac,google_play,customer,overpriced!!,2,2025-06-21 15:20:11
0aefffe32c9aa922e2084b4ccb09da1d,google_play,customer,Absolutely garbage app and the customer service is terrible. I get pissed off every time I use it.,1,2025-06-21 15:05:42
34ed4b18ccef5c987614b265185cedcc,google_play,customer,good service,5,2025-06-21 14:29:42
9540db872274f61e31a0f8ee34b415a1,google_play,customer,"since installing GrubHub, I've been highly satisfied with the service.",5,2025-06-21 12:03:55
84dd085303260dc2feb084cffe01385e,google_play,customer,hair in your food and they dont refund your order.,1,2025-06-21 10:18:20
56607ed66f1aaa58bf8a62cb36e61b11,google_play,customer,ABSOLUTELY TERRIBLE !! THEY WILL TELL YOU THE ORDER IS COMING AND CANCEL IT OR MAKE YOU WAIT 2 HOURS TO GET YOUR FOOD !! AND NO REFUNDS!! THERE IS NO GRUB HUB GUARANTEE!!,1,2025-06-21 07:35:53
a19d4762b10ada18d7fb922f33ec7afa,google_play,customer,Can't use this app. always giving error can't even enter my address,1,2025-06-21 03:47:20
e5b62e771bc1610c97f0e1bd1799479b,google_play,customer,they apparently hire drivers that steal food. this is exactly what just happened to me. I will literally never use this service again and I will make sure none of my friends do either.,1,2025-06-21 00:00:43
71d457d1fec37aa4ea05316676dd4a86,google_play,customer,CAN NOT CANCEL!!!! CONTINUES TO CHARGE!!!!,1,2025-06-20 22:42:38
f44ba71d9329a39566f771c10b9c350c,google_play,customer,"~10 years after GH bought out Foodler. Still havent implemented any sort of rewards system; neat. New review to make sure all are aware of the ghost kitchens on here- check the addresses of the places you're looking at! 9 ""restaurants"" will be the same address. Nothing wrong with that in theory, but in reality they choke out your search results. GH doesnt abide by their own sort by ""distance"", and showed me several ghost k's interspersed all down my feed. BOO",2,2025-06-20 22:22:40
1f9dc599e025c8abd44ff86357a174ae,google_play,customer,"The app acknowledged my order, but never actually sent it to the store. it resulted in me having to wait another 20 minutes for them to make my food.",1,2025-06-20 22:06:34
a07c7d966a0294c0fed4a49bacbf4305,google_play,customer,Great service.,5,2025-06-20 21:22:55
8bf79bbb4a526b313f04b8414a1ed1dc,google_play,customer,"Depressing looking app, Everytime I click on a restaurant it zooms out of the area. well done",1,2025-06-20 20:53:44
d9562d2ad2c8231d67bc35f74bc3d1ae,google_play,customer,good when it's free with prime,5,2025-06-20 20:20:37
8923e4a67f1fa3077423f3a2ce08922c,google_play,customer,Convenient app when I need food delivered. thank you Grubhub and thank you delivery drivers. 游땕,5,2025-06-20 19:47:02
b0269c20b899f889d85448e4378c903d,google_play,customer,good 游녨游,5,2025-06-20 19:35:26
74d9889198f740e06c9a13fd6d8da540,google_play,customer,I'm Loving it 游녨,5,2025-06-20 19:05:15
989660541532da9194e7b0c340a671f2,google_play,customer,Very user friendly!! 游땎,5,2025-06-20 18:10:01
01395f305668db8c6f8f76f16ca0fedc,google_play,customer,expensive.,3,2025-06-20 16:56:09
2b3d33e998da8ff046b6248719487bf3,google_play,customer,mid,3,2025-06-20 15:20:31
314d701a493508763333a0fb914b351a,google_play,customer,My go-to for Main Chick in Long Beach!,5,2025-06-20 14:36:26
bab91bff3f05bc53d56e9468719ff099,google_play,customer,Lin's Bistro is top notch.,5,2025-06-20 14:23:29
73a46072da1443a78e69a31cb812271d,google_play,customer,they need to have more deals,3,2025-06-20 13:31:55
e19c1dc2e1297330143a7478a75aa6b3,google_play,customer,good grief. Massive problems with driver. Company is no better. Can't use a discount with refundded credit.,1,2025-06-20 13:21:18
47870128eb0fdf0b25fc4b39531248d2,google_play,customer,Great delivery service app just as good or better then doordash,5,2025-06-20 12:30:40
e3651126bfbc0781942f670e7863429b,google_play,customer,Expensive.,1,2025-06-19 23:17:05
d63a77db5c9e938a7e23673f07e598ae,google_play,customer,Worst app ever Can't cancel from Restaurant or app because customer service is not responding,1,2025-06-19 23:00:40
