id,source,app_type,review,rating,date
eeb32ee90eb4b3ae330ca49a3e28dddb,google_play,customer,"ordered twice by mistake. I took the action to get the order canceled: went to cancel on app but grubhub did not allow me despite it being only seconds since I placed the order(stated ""they have started your order""), called the place to cancel the first order(which she did but she said I'll need to call grubhub to get a refund but overall the order was canceled on her end), and I even talked with a person on live chat grubhub. not only was I denied a refund I was only able to get credit.",1,2025-05-16 14:43:15
35638ee0d886baa001a618a031ce537c,google_play,customer,"Theyl pick restaurants who don't update their menu. when you cancel the orders because of too many changes, theyl flag your account for fraud.",1,2025-05-16 14:18:54
bf379998416ffdb9e73f93840234bd37,google_play,customer,"Orders get messed up on the regular. I say to order on one card & it charges another, orders are missing multiple items, & drivers are frequently late & its not due to traffic they are always held up at the restaurant. I don't know if restaurant so I don't know if its the app on the restaurant end but this isn't frequent on other food delivery apps. Quite disappointing, as I order for work this is a bad reflection on us with clients & its just too common on this app.",2,2025-05-16 13:54:32
795bcda851e182b92bf681f9e0a606c2,google_play,customer,super,5,2025-05-16 12:26:44
70a3cdf14408b31d7aa3dd4ae5df0259,google_play,customer,ggo with literally any other app.,1,2025-05-16 10:07:51
b510a3026f604f2a1578ccdda0007368,google_play,customer,"I tried them because of the free Grubhub+ with Amazon Prime. The orders always take forever to arrive even if you tip well. My order is always stacked with multiple other deliveries. I feel like I'm always the last one to get my food, and the food gets soggy. I will not continue to use them. DoorDash and UberEats are far superior.",1,2025-05-15 23:56:44
ddaefd9a76f5592962ff5be839b728a9,google_play,customer,countless orders postponed. address was accurate but it selects the farthest location sometimes.,3,2025-05-15 23:42:19
1544bf4f278fbff46ce87e5bc8143762,google_play,customer,"twice in a row I've ordered ice cream, and it's taken a ridiculous amount of time to arrive. an hour and a half tonight. ice cream! I had largely stopped using GH in favor of Door Dash because of how bad GH had gotten, but there are some places where the DD menus are glitch. plan on deleting my GH account at this point",1,2025-05-15 23:27:27
00a4efbe1d8503b097ecb25111bbc76f,google_play,customer,run away.,1,2025-05-15 22:52:57
721d7258a28efc534d3491237b4daaef,google_play,customer,there's no accountability with their drivers or even the restaurants with GrubHub,2,2025-05-15 22:25:05
a93be57f5ace33ab617e8750fb566af4,google_play,customer,mess up orders all the time,1,2025-05-15 21:19:22
7c8f29e16b951f0e58e8b240d8ce9606,google_play,customer,Great,5,2025-05-15 21:02:51
895470518f936bdf4bcbf14018b07614,google_play,customer,"I was on Grubhub back in the day, but it is deff turnt up now! Salute to the Amazon Prime Membership游삐",5,2025-05-15 19:27:03
186b92fb5b313e429a046c281aeb3930,google_play,customer,"For my last 3-4 orders, I have either received it late, or not at all. I placed an order this evening at 4:17 pm, with delivery expected in 45-60 minutes. It was delivered 2 HOURS later at 6:12 pm. All the melted cheese had hardened and it was disgusting. They refunded $7. If GrubHub can't get enough drivers to deliver hot food (or at least a little warm), they need to make some serious changes.",1,2025-05-15 18:55:23
37999c0100b229a893c1f26be374b859,google_play,customer,Great delivery service.,5,2025-05-15 17:49:47
0a6de5be1f9421e8bd89207954c28c58,google_play,customer,they will not discontinue the charges.,1,2025-05-15 17:47:38
c5490e87a34be8cd13fc1990536664f5,google_play,customer,I couldn't order a 1 topping pizza. I had to order 2 toppings in order to use this service,3,2025-05-15 17:43:00
7baef7ae467f9760743bb19cd5bb62c7,google_play,customer,"Used to be the best delivery service. Nowadays you're extremely lucky if you actually get what you ordered. A couple of weeks ago, basically half of my order was missing. 12 days later, still no refund.",1,2025-05-15 17:17:20
a274e69559041a38babdf38386ec23b1,google_play,customer,Why can't your app just ask for permissions when it actually needs my location? Why can't your app figure out that I'm not a bot? Isn't that what my login credentials are for?,1,2025-05-15 16:56:33
de11618fbb799e7a41c6bcc05608a89f,google_play,customer,Best pizza in the hood,5,2025-05-15 15:58:05
057a3d3c5745db93e72d9c071986c12e,google_play,customer,"So many times now I have had food take especially long to get to me, and today was probably the worst I've ever experienced, it was about 2 hours or so by the time I ordered my food before I finally sat down to eat it. It was likewarm and cold by that point. I don't blame the restaurant or necessarily the driver, but the fact that it took an hour & a half to finally get someone to go pick it up and bring it to me & not let me cancel or anything, absurd. I get that delays happen but this was nuts",2,2025-05-15 15:19:01
a011d186c861534290ee049abd014558,google_play,customer,"this app has 180춿 spun around! From trash to Class! this app has amazing service and great drivers. everyone of mine, have gone above and beyond there calling! I didn't get a drink, they go back and get it, I did not get my frys and BOOM the guys back in 120 seconds with fresh hot salty goodness and so much ketchup I have used it for the last week 游땫 ummm #SERVICE 100% THEE BEST DELIVERY APP, BAR NONE!!!!",5,2025-05-15 14:56:03
66f4e3babe2f51947e4580878bc85aff,google_play,customer,"There was a rather frustrating issue with my very first grubhub order. They refunded it, and that's enough to make me keep the app installed on my phone. But I'm not keen on giving them 5 stars unless they earn those 2 extra stars with better service moving forward. I don't think that's unreasonable of me. First impressions count.",3,2025-05-15 14:06:23
8247af5976892d5f62f55832d387a84e,google_play,customer,Love it,4,2025-05-15 13:24:57
ae71db10b17afb7f9e04af450c3d2eb3,google_play,customer,Has restaurants that Uber Eats and Door Dash don't.,5,2025-05-15 13:04:23
a7adc96d99fc4e912af3a70940ced5b5,google_play,customer,app asks me to review way to many times.,3,2025-05-15 12:59:35
4cd2e29840d60cfcb3e84e60a6b50b63,google_play,customer,"Way cheaper to call the restaurant: Just find the restaurant on Google, and you can save $10-$30 by avoiding the markup.",2,2025-05-15 12:50:51
f5290a8956712c60ff2816b57665c132,google_play,customer,app doesn't let me report missing items or even to add extra tip to drivers,1,2025-05-15 12:23:42
4c9c7a3a5756ec7cde2359b3b493bde4,google_play,customer,"ordered food that came in 2 bags, driver dropped off only 1 bag. driver info disappeared before I was able to reach out. contacted GH to have driver turn around. they did not. they refunded me and probably told driver to keep food. I did not want the refund. I just wanted my food. But no they couldn't do that. I will be deleting app. Severely disappointed...",1,2025-05-15 09:45:18
65de152c23c9d91ad01ebae8ee83e0ba,google_play,customer,"used it once to order person took almost 2 hrs and went somewhere else and I had to PAY to cancel the order and wasn't allowed a refund, app is kinda a joke",1,2025-05-15 09:34:41
1da8aaef7d3154cb704843b97897a718,google_play,customer,my food was all the way messed up only got one order and the customer service agent tried to be funny and when I ask to talk to the customer service manager she hung up in my face like I don't recommend this app to anyone and plus my order was 29.33 but they took 40.11 out my account which is not right,1,2025-05-15 01:39:46
c2c8be7ff1d3dca2c04dddf816b03f85,google_play,customer,So far so good on fast delivery.,4,2025-05-14 22:48:46
8a6557b1f7b0eab49c264d4a1ba241cd,google_play,customer,"I just got Costco delivered from another delivery app, tons of food, so much food i can't believe it, ill no longer use grubhub, the last time I tried to use grubhub the initial driver canceled on me forcing a driver switch, then while the 2nd driver was mid shopping grubhub decided it was taking too long and canceled my order, not the first time, but was certainly the last",1,2025-05-14 22:47:03
86646be5f1f2dabe503be9ed8a6dff77,google_play,customer,"Update, not better than Door Dash. Pretty much useless. Can't order to Hiltons even though they have a deal with them, currently unable to delete an order... Much better than Door Dash, but I order exclusively from hotels while I travel and the app is constantly saying it encountered an error and won't let me checkout with my hotel address. Once I change it to the same address but say I'm not at the hotel, it works. Why? Fix this and it's 5 stars but that's a huge inconvenience to me",1,2025-05-14 21:09:04
35b59d0adfa8f1360f451e749d2f8c63,google_play,customer,"won't link to amazon. I have disconnected through amazon, then click link and it still says it's connected to another account. I disconnect over amazon waited a few days and same thing. so oh well I don't get grubhub+ through amazon I don't use grubhub.",1,2025-05-14 18:48:50
cfc5e9ea8093693f8cf818910c10ec95,google_play,customer,"grubhub offers horrible customer service. they screw up and expect you to just deal with it. Their fix for cold food, wrong orders or hour old food is to offer you 5 dollars back for your next purchase. you are expected to be happy with the 100 percent messed up order after spending $50+ dollars, they gave you 5 back for your next order. why should we be complaining about loosing $45+ dollars? It's all about them not about their customers.",1,2025-05-14 18:13:31
282170a51d3b46fee80f6fc23b82ac70,google_play,customer,I love Panda Express,5,2025-05-14 17:43:45
29292bda814fd4026bce9d09760ad4aa,google_play,customer,"great halal food, their customer service is also good.",5,2025-05-14 17:10:07
072bfec7f4dda31b0b6fb6ba9cc3ae73,google_play,customer,I ordered a two hamburgers two fries refuse to bring to the door finally did when I said to her you're the first driver who didn't it want to bring it to the door she turned with the food around and left then they charged me another time so I paid 76 something for two burgers two fries that I never received and there's nothing in the app to complain they owe me $76 for food I did not receive I want my money back please respond!!,1,2025-05-14 16:19:33
f73f29238700d94717676c2e156094a7,google_play,customer,Superb!,5,2025-05-14 16:05:57
95df3ea667aef20ab2d0c1bda60af557,google_play,customer,Refund Credits expire in a month?! What a horrible company! Will be giving all my delivery business to DoorDash.,1,2025-05-14 14:28:05
dba8df7105bb8ac3d02785bae6a4f7a2,google_play,customer,no problem,5,2025-05-14 12:55:46
4e402b427f2fd3c53b93231aa6a95950,google_play,customer,"I'm home alone all week, husband works, with Stage 4 cancer and being able to order great food and have it delivered is a godsend!",5,2025-05-14 07:41:20
00edd34759acfdc75d203c718be2f952,google_play,customer,"EDIT: its still got connection issues, so I can't get any customer service help from within the app, or report anything. i keep getting some connectivity issues, which completely stops me from ordering anything. there's nothing i can do about that on my end, since ive tried everything.",1,2025-05-14 03:48:16
9cbdeec01d85e779f43db3382d9b7d56,google_play,customer,it's good its free with Amazon Prime and they give deals like free priority delivery sometimes,5,2025-05-13 20:43:52
642fc1ecdbb5cf6828fc8fc221086b33,google_play,customer,expensive,3,2025-05-13 19:39:28
302cc258bc5b3bb5b5e08ddef14291fd,google_play,customer,I hadnt used GH in a couple years and didnt realize i had an old work address up. They took care of it canceled the order and refunded so i could order to correct address. Really appreciated that.,5,2025-05-13 15:53:20
161fca3606c8eed9183aab340d489634,google_play,customer,Great delivery,5,2025-05-13 08:21:14
f250c347c7c78a176269f65eb8b8a207,google_play,customer,I don't want membership or to be included on mailing list,1,2025-05-12 22:18:32
6c7fa79a8104b639ff750ef84de99363,google_play,customer,Not enough drivers. Takes way too long. Not easy to delete your account. You have to contact them and submit a request and tak es 45 days. Use DoorDash instead.,1,2025-05-12 20:44:48
a5b458f04bf3f5bb9f804f7a994b3357,google_play,customer,"driver didn't care about my Boss order, onion rings were jumbled with coating falling off and the fish sandwich was loose ,it's a 1 mile drive for a tepid meal",3,2025-05-12 18:13:39
84b512dc531a661d57eee27b5341bc8f,google_play,customer,"I'm new, having just switched from DoorDash after my account was deactivated randomly. So far, so good.",5,2025-05-12 15:12:26
8b73dcd70ed59a0f48099eecde5d635f,google_play,customer,Good,3,2025-05-12 10:05:06
2beca2cdadc2ce43419b76ddd1e69d4d,google_play,customer,"out of the major services, Grubhub is the worst. Has more issues, late constantly and limited options. not sure why, but if it were not included in Prime, I would never use it at all.",1,2025-05-12 08:20:52
5b1f4297e92ce6fed4337952450b4823,google_play,customer,didn't want to sign up yearly,1,2025-05-12 07:34:06
86212be030437ee671ca2aa2e4758900,google_play,customer,The worst delivery service available,1,2025-05-11 22:46:29
45291ee6dc680b8266d5ab3d18726923,google_play,customer,the first time I used it had no issue but the last 2 times have been failures. I doubt I will try this app again. one was stashed delivered and never was and today was just cancelled.,1,2025-05-11 22:43:46
6548711d4d9251e932af283eca6fa0a7,google_play,customer,The wi-fi is lagging so much! It's difficult to download this Grubhub app. 游봏,5,2025-05-11 21:34:52
c3b32029586ba065bb7415c8dce1d9e0,google_play,customer,on time everything was perfect,5,2025-05-11 21:26:06
e4c269fc2cb04449dbe42e3204fb1930,google_play,customer,"way better than Uber and door dash, this is real savings to one of my favorites, will use to request food more often it'll be better",5,2025-05-11 18:48:18
f1091e7fc69339501b03faa4ff1be057,google_play,customer,horrible food is always delivered cold and incorrect,1,2025-05-11 18:43:27
6336c06cf3bfd079aada8d81717fbabf,google_play,customer,too easy,5,2025-05-11 18:39:34
4757be96faebf4435e55a306afa2e40d,google_play,customer,This used to be a good service but SUCKS lately. My last 5 orders have been late. There's no option to pay extra for direct delivery. I shouldn't have to wait an hour to receive a delivery of cold food from a restaurant 10 minutes from me... then only to get a few bucks off my next order. NO THANKS! I'm done with this app. Lately the drivers haven't even headed to the restaurant until AFTER the max expected delivery time.,1,2025-05-11 18:37:40
57441fbef01a41b389c2dc77ff241d29,google_play,customer,"I gave grubhub a 5 star review 2 years ago, but now I have to edit. food is always over an hour, the prices are getting higher, and now drivers are stealing food. they take the photo of it and then take the bag. my ring camera caught it and I was still only offered a $10 credit. Happy Mother's Day to me. I'll be deleting the app and picking up my own orders, it'll be cheaper and my kids will eat what was paid for... not me scrambling to cook something after paying over $100.",1,2025-05-11 18:37:01
e7f748adc5d0cfb7f755080bde86b0f1,google_play,customer,"Respectful, Courteous & Kind!!",5,2025-05-11 17:55:17
f10ae222e79b56332e66e85789ccd5e8,google_play,customer,grand,5,2025-05-11 17:22:41
b10f94ff33f99b7def665b6b1782c05f,google_play,customer,"I started using this because the service was considerably better than doordash but now this is the same trash app as doordash. every order I place now gets delayed because they allow drivers to take way too many orders at once. who wants hour old fast food that's just been steaming up in a heat bag? soggy, cold food all the time and now the customer support chat basically just tiptoes around helping you actually. there's absolutely no reason drivers should be allowed to take 5 different orders.",1,2025-05-11 17:15:09
5e0090490a00c793834cd7b46185b563,google_play,customer,"they will find every way to weasel out of any kind of repayment for incorrect, horribly late, or straight up undelivered orders. asking the driver to fix it themselves would be more useful than any support convo I've had",1,2025-05-11 15:47:47
1fa3c3366d5ef35a9cf07beae85db7c4,google_play,customer,always on time,5,2025-05-11 15:35:12
79506883c3bd59a0e765e11ba672d66f,google_play,customer,Slept on fr,5,2025-05-11 15:26:00
08d32980ebcfea0b24c5c7442d047087,google_play,customer,"Awesome, thank you GrubHub!",4,2025-05-11 12:38:52
fa0fdb13cbd1907259b3a9338b605cd2,google_play,customer,scammers. worst ever avoid!!!!!!,1,2025-05-11 10:30:45
ab1861423060dee285070a42695b9246,google_play,customer,app brings me food,5,2025-05-11 08:05:02
6fab261a2817972e21ad6c6ba23b8929,google_play,customer,"Stop using this service, only the drivers get tips and the take out employees for the location get nothing.",1,2025-05-11 01:40:08
f114f460deaa1dd75e507995a9b650af,google_play,customer,very quick .. even from far away..I'm new only used 3x. but very professional too,5,2025-05-10 23:24:53
1e4e9ef762e29d60195427d914194032,google_play,customer,"Scam, they change the delivery time after you order and gaslight by telling you they are not late, they also charge more for every item and hide it by showing the low fee cost making you think you are getting a better deal.",1,2025-05-10 22:48:41
18f10a0d27f139f5cf43ddd0ece1bba1,google_play,customer,"waaaaaaaay overprices the menu cost and adds tons of fees, yet they can never get the food there on time due to drivers multi-apping and taking too many orders.",1,2025-05-10 20:57:27
16f3f3a5018aaf9be97b535d783c5da9,google_play,customer,Great prompt delivery drivers!,4,2025-05-10 16:04:36
f3a54cd98aeb04f9bcc3f1343392135f,google_play,customer,"Works great, smooth process. I would highly suggest a ""rate/report your driver"" or an ""adjust tip"" after delivery because there have been several occasions where it is obvious the driver just straight up stole your food. There needs to be some way to assign more accountability. It seems unfair that the restaurants take the brunt of ""missing items"".",4,2025-05-10 15:28:36
c50a144a98603c26a0b8564f7b7db595,google_play,customer,love grub hub plus; also grubhubs customer service is always helpful. received someone elses order and they help us receive our order.,5,2025-05-10 15:22:07
5bd85a63d1a7d6a0564f4e148dd927e2,google_play,customer,"My hamburger was pink, and they only refunded me $0.05. Lately, orders take way longer than they should with grubhub stating that they're ""delayed"", even on places that usually are quick.",1,2025-05-10 12:49:08
70d800d9f4aea96ef8b7ac62fa859fd3,google_play,customer,awesome app,5,2025-05-10 09:38:23
2f2befba5ab8659fb50edcf46db91076,google_play,customer,Best Pizza in the Phoenix area!,5,2025-05-09 22:47:49
a88a48c861978f312ffefa3169c672d8,google_play,customer,"This app has gone down the gutter completely, I have GrubHub+ for free since I'm an Amazon Prime member and everything is still extremely price gouged, up to 5 dollars more just to order online, not including the absurd 8+ dollar delivery fees. I can officially say I don't use this app, even though I'm paid to.",1,2025-05-09 21:36:01
8d97185e2fcead446b7215fdb5f29e29,google_play,customer,"Food is over priced, eta times are made up. Drivers are always late with orders and can't follow a simple ""please knock on door"" request. Food is always cold and I mean always. When you message customer service about it there response is to offer a 5 dollar credit. Like that makes a difference. It'd be one thing if I did not have a medical reason as to why I currently can't drive. This was my only way of getting certain things delivered to me.",1,2025-05-09 21:06:35
bb10246146c5c1afa20faaa04f1b5739,google_play,customer,the toolbar notification doesn't show in dark mode. please allow for color to be changed,1,2025-05-09 21:00:34
e1f825c98053a08a82fe5a727c09a6f8,google_play,customer,do yourself a favor and use doordash most reliable service,1,2025-05-09 20:58:39
544dec2d45e6d836eaec518e871287a6,google_play,customer,pay to have someone who can't even read the receipt mess up your order.,1,2025-05-09 20:35:47
fa3cbd1a785a6642a03a2d675228e796,google_play,customer,Great,5,2025-05-09 18:10:31
b72eb1253552bf66e990fbe6b389c353,google_play,customer,Installed hoping for a good selection. Only 2 places come up Dunkin & Wendys EPIC FAIL!!!!! Uninstalling!,1,2025-05-09 18:04:51
d1b45bf9c1ce3c3b9403aced82e5e3ba,google_play,customer,i pay a monthly fee and still get charged an arm and and leg,1,2025-05-09 17:33:25
587373586a60b2fa0cbef543fee4e974,google_play,customer,"Food never arrives alot, it's late and sucks most of the time. When you got a broken leg you gotta get it delivered. Your up to there mercy.",2,2025-05-09 15:21:38
62ac91209d022fd51d62ac436cabecc9,google_play,customer,doesn't update as well as the website,2,2025-05-09 13:21:26
8be62cdda2b3448f37e332eb5356f736,google_play,customer,The amount of order failures and mis deliveries is staggering. I only use this service since it's free with Amazon prime.,1,2025-05-09 11:55:28
7fe8eedda4e913f676dd866f6de03228,google_play,customer,good food delivery app,5,2025-05-09 11:55:05
06313f72f515d32ddb00f1a7bd0f749d,google_play,customer,Great means of delivery,5,2025-05-09 09:39:18
968f3937c76bf984219d1642d28ad248,google_play,customer,don't ever order from this app u will never get your food 游땫,1,2025-05-09 07:45:50
5e8606cc8077e1e05e1de2549c3d0f0a,google_play,customer,"I keep getting an error page when I click ""help"" or ""extra tip"". I had a fantastic, kind driver, and I wanted to toss him an extra $5, and I can't. Deleted the app, reinstalled, force stopped, cleared cache, tried on wifi, tried on cellular. I've got a Galaxy S25 Ultra, and Amazon only makes eleven zillion dollars a day, so I'm thinking a working app shouldn't be too high an expectation, but here we are. I took a screen recording, can a dev reach out? I'm mad at Bezos, not you.",1,2025-05-08 23:07:58
f2d96d524101c9720bf99798ac6bf12f,google_play,customer,first time using,5,2025-05-08 21:49:21
2fac4cd1d281434b0ea39dd20e00daf1,google_play,customer,"at 830 pm I ordered 2 blasts from Sonic, at 940 pm they still haven't arrived and the ETA of my order was now 1015-1030. almost 2 hours late. this is ridiculous. don't support GrubHub, just do a pick up instead.",1,2025-05-08 21:40:08
6dacd9b2ca114228508e5b55a91768d1,google_play,customer,racoon ate my food,1,2025-05-08 21:28:24
33043a3e3a8b7d6c7b1ed6dcf2aa9018,google_play,customer,"I think the service through the app is very simple to use, if you have any issues they somehow will fix it. Will see how it holds down the road. I will keep you updated as the process goes.",4,2025-05-08 20:30:57
d8bf56dae02a605f2af05106cb36e8d7,google_play,customer,"caught them trying to defraud me from an order, i orderd sevral items from a restraunt and only received 3/4 items, i called the restraunt and they advised they only got an order for 3, called grubhub, they told me they sent the order for 4 then tried to talk me into looking for the missing item. not goin for it, requested them to delete my account and uninstalled.",1,2025-05-08 19:56:40
6738dc63074836ad74dd785792c12549,google_play,customer,"I'm shocked at how poor their customer service is! I asked them to cancel my subscription a couple of times, including in Dec. 2024, last year. I just realized that they had sneakily continued to charge me monthly, so I emailed them again, demanding cancelation. This time they promptly obliged but refused to refund more than just one arbitrary month. It was THEIR MISTAKE and out of pure greed, they REFUSE to refund the months they dishonestly charged me for. I will never use GrubHub again!游땨",1,2025-05-08 19:38:13
1a8a73dab22b81b385344a7f9f888634,google_play,customer,"While I like that I can order to have it delivered, maybe let the drivers know to not break the sauce container in the bag.",2,2025-05-08 19:24:32
66057295453dd565f21f40895bd5bef6,google_play,customer,If I have it delivered the driver has to either knock and ask me if I'm who I am and they take a picture of the food when I clearly said to hand me the food. Also if I said to take a picture of the food on the ground they hand it to me instead and knock.,4,2025-05-08 19:02:45
24f528a26e469b2bc26b630ef5fd3b36,google_play,customer,grub hub is mostly great except when the delivery drivers forget to bring the drink.,4,2025-05-08 18:52:59
e87f1f47a8ba341d79ecbcf914ada9c5,google_play,customer,"wonderful delivery service, been using for years while also traveling to different states, very helpful",5,2025-05-08 18:40:12
070533e376fd366c412df924feb428ef,google_play,customer,Their driver ate my food... then I got stuck with a chat bot for 30 mins. they then tried charging the cost back to the restaurant. once the restaurant confirms and sends me proof they were charged I will be filing a complaint with the BBB. use any other app this company doesn't care about its customers. just shaving costs,1,2025-05-08 18:18:54
526d39c0cd52d29b3bf3d0ffcd9c2f93,google_play,customer,exceptional customer service. I would never use another food delivery unless grubhub goes out of business. I recommend to everyone.,5,2025-05-08 15:14:37
6048eeea12ec36cb31418bb377e641f2,google_play,customer,"good service, easy to use app, and the convenience fees seem to be less than other apps.",5,2025-05-08 14:16:24
6024b45a85d9c7a51311c11527e36425,google_play,customer,amazon version of the app doesn't work. pos,1,2025-05-08 13:47:27
